{
  "$schema": "../schema/theme-v1.schema.json",
  "id": "parchment",
  "name": "Parchment",
  "author": "Spiral",
  "description": "Warm off-white and sepia tones, like a well-lit record shop.",
  "tokens": {
    "color-bg": "#f4efe6",
    "color-surface": "#ebe4d8",
    "color-surface-raised": "#e2d9ca",
    "color-text-primary": "#3d3428",
    "color-text-secondary": "#7a6f5e",
    "color-accent": "#c47a20",
    "color-accent-muted": "#e8c9a0",
    "color-border": "#d4c9b8",
    "color-danger": "#b54a3a",
    "color-danger-bg": "#f0ddd8",
    "color-alert-info": "#4a5a9e",
    "color-alert-info-bg": "#e4e8f5",
    "color-alert-info-border": "#b8c4e8",
    "color-alert-success": "#3a7a4a",
    "color-alert-success-bg": "#dcefe0",
    "color-alert-success-border": "#a8d4b0",
    "color-alert-warning": "#9a7020",
    "color-alert-warning-bg": "#f5ecd8",
    "color-alert-warning-border": "#e8d4a0",
    "color-alert-error": "#b54a3a",
    "color-alert-error-bg": "#f0ddd8",
    "color-alert-error-border": "#d4a8a0",
    "radius-card": "12px",
    "radius-button": "8px",
    "font-ui": "'Iowan Old Style', 'Palatino Linotype', Georgia, serif"
  }
}
